<!ELEMENT document (customer)*> 
<!ELEMENT customer (name,date,orders)> 
<!ELEMENT name (firstname,lastname)> 
<!ELEMENT firstname (#PCDATA)> 
<!ELEMENT lastname (#PCDATA)> 
<!ELEMENT date (#PCDATA)> 
<!ELEMENT orders (item)*> 
<!ELEMENT item (product,number,price)> 
<!ELEMENT product (#PCDATA)> 
<!ELEMENT number (#PCDATA)> 
<!ELEMENT price (#PCDATA)> 